[
  {
    "id": "dbm-fy2026-solar-water-system-duale",
    "kind": "infrastructure",
    "title": "Construction of Solar Water System, Barangay Duale, Limay, Bataan",
    "year": 2026,
    "amount": 10000000,
    "unit": "PHP",
    "status": "appropriated",
    "sourceAgency": "Department of Budget and Management / Department of Public Works and Highways",
    "contractor": null,
    "location": "Barangay Duale, Limay, Bataan",
    "howToRead": "This is a national-government FY 2026 appropriation reference. It is not evidence that the Municipality of Limay executed the project, awarded a contract, or spent the full amount.",
    "provenance": {
      "source_url": "https://www.dbm.gov.ph/wp-content/uploads/GAA/GAA2026/DBM-OFFICIAL-GAZETTE-FY-2026_VOLUME-1-C.pdf",
      "source_name": "Department of Budget and Management — Official Gazette FY 2026, Volume I-C",
      "retrieved_at": "2026-09-22",
      "verified": true,
      "verification_note": "The Region III section lists the project under Bataan 2nd District Engineering Office with an amount of PHP 10,000,000."
    }
  },
  {
    "id": "dbm-fy2026-rehabilitation-road-phase-3-duale",
    "kind": "infrastructure",
    "title": "Rehabilitation of Road, Phase 3, Barangay Duale, Limay, Bataan",
    "year": 2026,
    "amount": 50000000,
    "unit": "PHP",
    "status": "appropriated",
    "sourceAgency": "Department of Budget and Management / Department of Public Works and Highways",
    "contractor": null,
    "location": "Barangay Duale, Limay, Bataan",
    "howToRead": "This is a national-government FY 2026 appropriation reference. It is not evidence that the Municipality of Limay executed the project, awarded a contract, or spent the full amount.",
    "provenance": {
      "source_url": "https://www.dbm.gov.ph/wp-content/uploads/NEP2026/Details-of-DPWH.pdf",
      "source_name": "Department of Budget and Management — FY 2026 Expenditure Program, DPWH details",
      "retrieved_at": "2026-09-22",
      "verified": true,
      "verification_note": "The Bataan 2nd District Engineering Office section lists the project with an amount of PHP 50,000,000."
    }
  },
  {
    "id": "philgeps-25cb0017-limay-bypass-road",
    "kind": "procurement",
    "title": "25CB0017: Construction of Limay By-Pass Road, Limay, Bataan",
    "year": 2025,
    "amount": 16713900,
    "unit": "PHP",
    "status": "awarded",
    "sourceAgency": "Department of Public Works and Highways — Bataan 2nd District Engineering Office",
    "contractor": null,
    "location": "Limay, Bataan",
    "howToRead": "This is the Approved Budget for the Contract shown in a PhilGEPS bid notice. It is not the final paid amount, and no contractor is listed here unless the source record explicitly identifies one.",
    "provenance": {
      "source_url": "https://notices.philgeps.gov.ph/GEPSNONPILOT/Tender/PrintableBidNoticeAbstractUI.aspx?refid=11407627",
      "source_name": "Philippine Government Electronic Procurement System — Bid Notice Abstract 11407627",
      "retrieved_at": "2026-09-22",
      "verified": true,
      "verification_note": "The notice identifies solicitation 25CB0017, an Approved Budget for the Contract of PHP 16,713,900, and status Awarded."
    }
  },
  {
    "id": "coa-2024-total-assets",
    "kind": "financial-statement",
    "title": "Total assets",
    "year": 2024,
    "amount": 5912684685.44,
    "unit": "PHP",
    "status": "audited",
    "sourceAgency": "Commission on Audit",
    "howToRead": "Audited figure for calendar year 2024 as reported by the Commission on Audit in its Annual Audit Report on the Municipality of Limay. This is an audited actual for a year that has already closed, not a budget or a forecast. Taken from the Statement of Financial Position.",
    "provenance": {
      "source_name": "Commission on Audit",
      "retrieved_at": "2026-09-23",
      "verified": true,
      "verification_note": "Transcribed from the audited report named in this record's source.",
      "source_document": "Annual Audit Report on the Municipality of Limay, Bataan for CY 2024",
      "source_issued": "2025-12-03"
    }
  },
  {
    "id": "coa-2024-total-liabilities",
    "kind": "financial-statement",
    "title": "Total liabilities",
    "year": 2024,
    "amount": 1306094835.66,
    "unit": "PHP",
    "status": "audited",
    "sourceAgency": "Commission on Audit",
    "howToRead": "Audited figure for calendar year 2024 as reported by the Commission on Audit in its Annual Audit Report on the Municipality of Limay. This is an audited actual for a year that has already closed, not a budget or a forecast. Taken from the Statement of Financial Position.",
    "provenance": {
      "source_name": "Commission on Audit",
      "retrieved_at": "2026-09-23",
      "verified": true,
      "verification_note": "Transcribed from the audited report named in this record's source.",
      "source_document": "Annual Audit Report on the Municipality of Limay, Bataan for CY 2024",
      "source_issued": "2025-12-03"
    }
  },
  {
    "id": "coa-2024-total-current-assets",
    "kind": "financial-statement",
    "title": "Total current assets",
    "year": 2024,
    "amount": 3083460491.06,
    "unit": "PHP",
    "status": "audited",
    "sourceAgency": "Commission on Audit",
    "howToRead": "Audited figure for calendar year 2024 as reported by the Commission on Audit in its Annual Audit Report on the Municipality of Limay. This is an audited actual for a year that has already closed, not a budget or a forecast. Taken from the Statement of Financial Position.",
    "provenance": {
      "source_name": "Commission on Audit",
      "retrieved_at": "2026-09-23",
      "verified": true,
      "verification_note": "Transcribed from the audited report named in this record's source.",
      "source_document": "Annual Audit Report on the Municipality of Limay, Bataan for CY 2024",
      "source_issued": "2025-12-03"
    }
  },
  {
    "id": "coa-2024-total-non-current-assets",
    "kind": "financial-statement",
    "title": "Total non-current assets",
    "year": 2024,
    "amount": 2829224194.38,
    "unit": "PHP",
    "status": "audited",
    "sourceAgency": "Commission on Audit",
    "howToRead": "Audited figure for calendar year 2024 as reported by the Commission on Audit in its Annual Audit Report on the Municipality of Limay. This is an audited actual for a year that has already closed, not a budget or a forecast. Taken from the Statement of Financial Position.",
    "provenance": {
      "source_name": "Commission on Audit",
      "retrieved_at": "2026-09-23",
      "verified": true,
      "verification_note": "Transcribed from the audited report named in this record's source.",
      "source_document": "Annual Audit Report on the Municipality of Limay, Bataan for CY 2024",
      "source_issued": "2025-12-03"
    }
  },
  {
    "id": "coa-2024-total-revenue",
    "kind": "financial-statement",
    "title": "Total revenue",
    "year": 2024,
    "amount": 1265302498.41,
    "unit": "PHP",
    "status": "audited",
    "sourceAgency": "Commission on Audit",
    "howToRead": "Audited figure for calendar year 2024 as reported by the Commission on Audit in its Annual Audit Report on the Municipality of Limay. This is an audited actual for a year that has already closed, not a budget or a forecast. Taken from the Statement of Financial Performance.",
    "provenance": {
      "source_name": "Commission on Audit",
      "retrieved_at": "2026-09-23",
      "verified": true,
      "verification_note": "Transcribed from the audited report named in this record's source.",
      "source_document": "Annual Audit Report on the Municipality of Limay, Bataan for CY 2024",
      "source_issued": "2025-12-03"
    }
  },
  {
    "id": "coa-2024-surplus-deficit-for-the-period",
    "kind": "financial-statement",
    "title": "Surplus for the period",
    "year": 2024,
    "amount": 293495147.79,
    "unit": "PHP",
    "status": "audited",
    "sourceAgency": "Commission on Audit",
    "howToRead": "Audited figure for calendar year 2024 as reported by the Commission on Audit in its Annual Audit Report on the Municipality of Limay. This is an audited actual for a year that has already closed, not a budget or a forecast. Taken from the Statement of Financial Performance.",
    "provenance": {
      "source_name": "Commission on Audit",
      "retrieved_at": "2026-09-23",
      "verified": true,
      "verification_note": "Transcribed from the audited report named in this record's source.",
      "source_document": "Annual Audit Report on the Municipality of Limay, Bataan for CY 2024",
      "source_issued": "2025-12-03"
    }
  },
  {
    "id": "coa-2024-total-cash-inflows",
    "kind": "financial-statement",
    "title": "Total cash inflows",
    "year": 2024,
    "amount": 1193319018.86,
    "unit": "PHP",
    "status": "audited",
    "sourceAgency": "Commission on Audit",
    "howToRead": "Audited figure for calendar year 2024 as reported by the Commission on Audit in its Annual Audit Report on the Municipality of Limay. This is an audited actual for a year that has already closed, not a budget or a forecast. Taken from the Statement of Cash Flows.",
    "provenance": {
      "source_name": "Commission on Audit",
      "retrieved_at": "2026-09-23",
      "verified": true,
      "verification_note": "Transcribed from the audited report named in this record's source.",
      "source_document": "Annual Audit Report on the Municipality of Limay, Bataan for CY 2024",
      "source_issued": "2025-12-03"
    }
  },
  {
    "id": "coa-2024-total-revenues-and-receipts",
    "kind": "financial-statement",
    "title": "Total revenues and receipts",
    "year": 2024,
    "amount": 1265451623.41,
    "unit": "PHP",
    "status": "audited",
    "sourceAgency": "Commission on Audit",